{
  "schemaVersion": "lesson-v1",
  "id": "promotion-trust",
  "version": "1.0.0",
  "title": "Promotion trust",
  "summary": "Assess promotion evidence without inventing a common grain.",
  "level": "mid",
  "competencies": [
    {
      "id": "decision-traceability"
    },
    {
      "id": "data-contracts"
    }
  ],
  "outcome": {
    "capability": "Explain why four independent evidence grains cannot prove campaign causality.",
    "evidenceIds": [
      "critical-assertions",
      "decision-response"
    ]
  },
  "stakeholder": {
    "actor": "Retail Operations Director",
    "concern": "promotion decision trust",
    "decision": "Can promotion evidence support causal attribution?"
  },
  "prerequisites": [
    {
      "id": "golden-small-42",
      "kind": "environment",
      "required": true
    }
  ],
  "prerequisiteChecks": [
    {
      "probeId": "golden-runtime-read-only-required",
      "kind": "contract",
      "class": "required",
      "expected": "pass",
      "remediation": "Establish the admitted golden runtime.",
      "retry": "read-only"
    }
  ],
  "fr": [
    {
      "id": "validate-four-grains",
      "measure": "Exactly four independent grains are preserved."
    }
  ],
  "nfr": [
    {
      "id": "offline",
      "measure": "No network access."
    },
    {
      "id": "bounded",
      "measure": "Within declared resource limits."
    }
  ],
  "asr": [
    {
      "id": "single-completion-authority",
      "measure": "Only progress CAS emits completion."
    }
  ],
  "architectureViews": [
    {
      "id": "system-context",
      "required": true
    },
    {
      "id": "promotion-evaluation-dynamic",
      "required": true
    }
  ],
  "decision": {
    "question": "Can the four grains prove campaign causality?",
    "alternatives": [
      "claim-common-grain",
      "retain-independent-grains"
    ],
    "selected": "retain-independent-grains",
    "status": "insufficient-evidence/no-common-grain"
  },
  "patterns": [
    {
      "id": "decision-evidence-bundle",
      "addressedRisk": "unsupported-causal-attribution"
    }
  ],
  "narrativeSteps": [
    {
      "id": "frame",
      "order": 1,
      "reversible": true,
      "staticEquivalent": true
    },
    {
      "id": "inspect",
      "order": 2,
      "reversible": true,
      "staticEquivalent": true
    },
    {
      "id": "run",
      "order": 3,
      "reversible": true,
      "staticEquivalent": true
    },
    {
      "id": "fail",
      "order": 4,
      "reversible": true,
      "staticEquivalent": true
    },
    {
      "id": "trace",
      "order": 5,
      "reversible": true,
      "staticEquivalent": true
    },
    {
      "id": "decide",
      "order": 6,
      "reversible": true,
      "staticEquivalent": true
    },
    {
      "id": "reset",
      "order": 7,
      "reversible": true,
      "staticEquivalent": true
    },
    {
      "id": "configure",
      "order": 8,
      "reversible": true,
      "staticEquivalent": true
    },
    {
      "id": "verify",
      "order": 9,
      "reversible": true,
      "staticEquivalent": true
    },
    {
      "id": "reflect",
      "order": 10,
      "reversible": true,
      "staticEquivalent": true
    }
  ],
  "lab": {
    "id": "promotion-trust-v1",
    "version": "1.0.0"
  },
  "evidence": [
    {
      "assertionId": "critical-assertions",
      "required": true
    },
    {
      "assertionId": "decision-response",
      "required": true
    }
  ],
  "reflection": {
    "prompt": "Which additive grain would support causal attribution?",
    "completes": false
  },
  "accessibility": {
    "keyboard": true,
    "announcements": true,
    "staticEquivalent": true,
    "reducedMotion": true
  },
  "remediation": [
    {
      "code": "PROMOTION_COMMON_GRAIN_FORBIDDEN",
      "action": "Retain the four grains and state the limitation.",
      "revealPolicy": "after-ordered-hints"
    }
  ],
  "hints": [
    {
      "id": "inspect-grains",
      "order": 1,
      "revealAfter": 0,
      "evidenceEvent": "guidance-viewed",
      "completes": false
    },
    {
      "id": "compare-keys",
      "order": 2,
      "revealAfter": 1,
      "evidenceEvent": "guidance-viewed",
      "completes": false
    },
    {
      "id": "state-limitation",
      "order": 3,
      "revealAfter": 2,
      "evidenceEvent": "guidance-viewed",
      "completes": false
    }
  ]
}
